,brief,classes_name,header,news_url,pubtime,savetime
69,田卫东称，中国芯片行业正在酝酿巨大的商业机会，其中分销代理行业也因为庞大的市场规模有机会诞生世界级的企业。,澎湃新闻,广西河池一教师涉嫌猥亵多名学生被逮捕，校长、副校长被免职,https://www.thepaper.cn/newsDetail_forward_2414668,2小时前,2018-09-06 20:42:08
70,9月5日上午，河池市宜州区刘三姐镇中心小学8名学生家长以自家孩子被该校一男教师猥亵为由，到宜州区委党校门口聚集，要求严惩涉事教师，并给予经济赔偿。,澎湃新闻,江西万安现发霉“营养餐”，有学生住院,https://www.thepaper.cn/newsDetail_forward_2415054,2小时前,2018-09-06 20:42:09
71,9月3日，江西吉安万安县，有家长举报称宝山乡、涧田乡多所小学配送的营养餐存在大量腐败变质的问题。万安县委通告称已对供餐企业做出处罚，事件正进一步调查中。,澎湃新闻,广东大气污染防治条例草案征求意见：珠三角禁止新建重污项目,https://www.thepaper.cn/newsDetail_forward_2415184,2小时前,2018-09-06 20:42:09
72,根据草案，珠江三角洲区域将禁止新建、扩建国家规划外的钢铁、原油加工、乙烯生产、造纸、水泥、平板玻璃、除特种陶瓷以外的陶瓷、有色金属冶炼等大气重污染项目。,澎湃新闻,任广东珠海市市长一职不到四个月，李泽中涉两罪被公诉,https://www.thepaper.cn/newsDetail_forward_2415161,2小时前,2018-09-06 20:42:09
73,日前，广东省珠海市原市委副书记、市长李泽中涉嫌受贿罪、国有公司人员滥用职权罪一案，经广东省人民检察院指定管辖，由中山市检察院依法向中山市中级人民法院提起公诉。,澎湃新闻,城市与社会 | 房产经纪人的“利”与“害”,https://www.thepaper.cn/newsDetail_forward_2414891,2小时前,2018-09-06 20:42:09
74,对他们而言，往后一步或者停留原地意味着落入无保障、高风险的“底层”，而往前一步才有可能分享房地产这个暴利行业中的利润，实现阶层的逆袭。,澎湃新闻,中国驻大阪总领事馆为滞留旅客提供最新信息：含航班改签等,https://www.thepaper.cn/newsDetail_forward_2415167,2小时前,2018-09-06 20:42:09
75,为解决滞留中国旅客实际困难，我馆整理汇总航班改签、签证延期等最新信息，并追加公布紧急联络电话，为滞留中国旅客尽可能提供支持和帮助。,澎湃新闻,小黄车也被投诉“退款难”：网友称退押金时被诱导升级为年卡,https://www.thepaper.cn/newsDetail_forward_2414697,2小时前,2018-09-06 20:42:09
76,记者从支付宝入口进入OFO页面，按照页面提示一路点到“退押金”，没有发现“自动购买年卡”的选项，但最后还是显示“退款失败”。退款过程重复了十次，均以失败告终。,澎湃新闻,教育改革 | 整体推进去功利化是中国教育改革的使命,https://www.thepaper.cn/newsDetail_forward_2413923,3小时前,2018-09-06 20:42:09
77,高考改革的出路在于教招考分离，最终实现中学自主教学、大学自主招生、考试社会评价。整体推进教育去功利化，才是我国教育改革的使命。,澎湃新闻,珠海原市长李泽中涉嫌受贿、国有公司人员滥用职权案被公诉,https://www.thepaper.cn/newsDetail_forward_2415062,3小时前,2018-09-06 20:42:09
78,日前，广东省珠海市原市委副书记、市长李泽中（正厅级）涉嫌受贿罪、国有公司人员滥用职权罪一案，由中山市人民检察院依法向中山市中级人民法院提起公诉。,澎湃新闻,甘肃又一景区遭破坏：游客在天池游泳拍抖音，被责令写保证书,https://www.thepaper.cn/newsDetail_forward_2414735,3小时前,2018-09-06 20:42:09
79,近日，几名游客在甘肃文县天池景区内戏水游泳并发抖音炫耀，景区安全巡查员发现后及时制止。目前，违规游客已作出书面道歉和保证。,澎湃新闻,欧委会终止对华光伏产业双反措施，商务部：化解分歧的典范,https://www.thepaper.cn/newsDetail_forward_2415163,3小时前,2018-09-06 20:42:09
80,欧方宣布终止对华光伏产品的双反措施，反映了两国业界的呼声，也是在当前个别国家单边主义、贸易保护主义抬头的大背景之下，欧方推动自由贸易向前发展的务实举措。,澎湃新闻,【社论】住宅70年“免费续期”能否进入《民法典》？,https://www.thepaper.cn/newsDetail_forward_2414630,3小时前,2018-09-06 20:42:09
81,未来的《民法典》将是中国改革40多年的经济成就的法律总结，也势必成为人类立法史上的一座里程碑，当为后代百世垂范立则，提供更为稳定的财产权益预期。,澎湃新闻,明起原油期货SC1810合约涨跌停板幅度由5%调整为8%,https://www.thepaper.cn/newsDetail_forward_2415154,3小时前,2018-09-06 20:42:10
82,经研究决定，自2018年9月7日（周五）起，原油期货SC1810合约的涨跌停板幅度由5%调整为8%。,澎湃新闻,贵州高速公路集团原党委书记耿黔生等被开除党籍,https://www.thepaper.cn/newsDetail_forward_2415037,3小时前,2018-09-06 20:42:10
83,贵州高速公路集团有限公司原党委书记、董事长，省十二届人大财经委原委员耿黔生被开除党籍；贵州高速公路集团有限公司原党委委员、副总经理马兆平被开除党籍和公职。,澎湃新闻,秦洪看盘｜A股市场指数不振，难掩优质股构筑底部的盘面亮点,https://www.thepaper.cn/newsDetail_forward_2414924,3小时前,2018-09-06 20:42:10
84,在操作中，对短期走势固然需要予以足够的谨慎，但是，对于市场参与者来说，目前需要重视优质股已率先构筑底部形态的积极信号，进而加大对优质股的选择力度。,澎湃新闻,山东寿光排水排涝接近尾声，消防增援力量陆续撤离,https://www.thepaper.cn/newsDetail_forward_2414802,3小时前,2018-09-06 20:42:10
85,9月6日凌晨3时，山东寿光受灾地区应急排涝任务基本完成，由应急管理部紧急调动的天津、河北、江苏消防部队增援力量开始陆续撤离。,澎湃新闻,奶粉引发家庭矛盾，杭州男子将3个月大儿子甩出摔伤获缓刑,https://www.thepaper.cn/newsDetail_forward_2414474,3小时前,2018-09-06 20:42:10
86,大力交代，之所以把儿子摔出去，是因为当时“心情烦躁，失去了理智”。现在养一个孩子的压力就很大，儿子是二胎。之前自己做生意亏了很多钱，老婆又不理解自己。,澎湃新闻,视频|准大学生无证开车去开学：先报到再被拘,https://www.thepaper.cn/newsDetail_forward_2414279,3小时前,2018-09-06 20:42:10
87,9月2日，湖南邵阳。一名女生与父母一同开车去大学报到。女生称自己已通过科三，觉得可以先开车。因无证驾驶，女生面临行拘。民警允许其先去报到，假期再来处理违法行为。,澎湃新闻,视频|司机高速上倒车，同伴下车肉身挡车牌,https://www.thepaper.cn/newsDetail_forward_2414877,3小时前,2018-09-06 20:42:10
88,9月2日，山东济宁。一轿车在高速上违规倒车，并让一名男子下车用身体遮挡号牌，司机还亲自“示范”，发现监控后，驾车离开。该车将被一次性记24分，罚款400元。,澎湃新闻,成都司机划拳化解纠纷后：成处理擦剐事故模范，疲于应对网友,https://www.thepaper.cn/newsDetail_forward_2413226,3小时前,2018-09-06 20:42:10
89,两人成为“网红”后的烦恼：无休止的各类陌生电话、短信和热心人的问候……尽管有时疲于应对，但两人仍觉得，能为天性乐观的成都人“代言”，也不失为一次好机会。,澎湃新闻,农村少年手机病调查：不吃不喝威胁父母充值，当托养瘾谋生,https://www.thepaper.cn/newsDetail_forward_2414835,3小时前,2018-09-06 20:42:10
90,17岁的湖南岳阳农村少年小涛（化名），在沉迷于手机直播软件后，以不吃不喝等方式威胁父母给钱，短短两个月，手机充值花掉了两万多元。,澎湃新闻,视频|家长入院救治，班主任微信群帮求助,https://www.thepaper.cn/newsDetail_forward_2414457,3小时前,2018-09-06 20:42:10
91,9月3日，陕西西安。学生家长吴应龙在西光实验小学门口张贴了一张感谢信。6月他曾因身体原因入院，班主任卜翼楠老师将信息发送到班级群后，多名家长赶往医院献血。,澎湃新闻,外交部回应瑙鲁总统指责中国不尊重太平洋：应为拙劣闹剧道歉,https://www.thepaper.cn/newsDetail_forward_2414849,3小时前,2018-09-06 20:42:11
92,华春莹表示，瑙方有关言论和事实完全不符，纯属颠倒黑白、倒打一耙，事实上恰恰是瑙方的错误言行令多数论坛成员国领导人感到失望，应该反思和道歉的恰恰是瑙鲁方面。,澎湃新闻,媒体探访：洪泽湖湖水已无臭味，渔民准备恢复生产,https://www.thepaper.cn/newsDetail_forward_2414679,3小时前,2018-09-06 20:42:11
93,9月4日，距离这一事件发生已经整整10天，目前胜利村居民灾后生活的情况如何？扬子晚报记者到现场进行探访。,澎湃新闻,2只养老目标基金9月10日开售，将在互联网平台上试水发行,https://www.thepaper.cn/newsDetail_forward_2414289,3小时前,2018-09-06 20:42:11
94,继华夏基金之后，中欧基金、泰达宏利基金9月10日也将启动旗下首只养老目标基金的发行。值得注意的是，首批养老目标基金也将拉开互联网平台发行的序幕。,澎湃新闻,二十年后喂饱我们的，会是虫子吗？,https://www.thepaper.cn/newsDetail_forward_2413858,3小时前,2018-09-06 20:42:11
95,面对吃虫子这件事，我怂。可食用昆虫营养、环保，饲料比也很理想。国内虽然有一些地区有食用虫子的传统，但大规模的运用还遥遥无期。你吃过虫子吗？会愿意尝试吗？,澎湃新闻,城市里，为什么越来越多的人喜欢养狗？,https://www.thepaper.cn/newsDetail_forward_2414207,4小时前,2018-09-06 20:42:11
96,我到现在还记得我七八岁的时候养的那条狗，是一条“串串”，名字叫多多。也记得当时妈妈和我的约法三章。,澎湃新闻,国防部回应英军舰擅闯西沙：采取一切措施捍卫主权,https://www.thepaper.cn/newsDetail_forward_2414758,4小时前,2018-09-06 20:42:11
97,8月31日，英国“海神之子”号船坞运输舰未经中国政府允许，擅自非法进入中国西沙群岛领海。中国军队依法依规派出舰机对英舰实施查证识别，并予以警告驱离。,澎湃新闻,特朗普遭“逼宫”？高官匿名发文披露细节，白宫怒查“内贼”,https://www.thepaper.cn/newsDetail_forward_2414218,4小时前,2018-09-06 20:42:11
98,9月5日，《纽约时报》罕见地刊登一名特朗普政府高级官员的匿名文章，称特朗普政府中的许多官员正在辛勤工作，试图从内部挫败特朗普的一些政策以及他最糟糕的倾向。,澎湃新闻,从上海坐地铁去苏州有望成真！苏州轨交S1线建设获批,https://www.thepaper.cn/newsDetail_forward_2414710,4小时前,2018-09-06 20:42:11
99,S1号线起点与苏州3号线终点站夷亭路站衔接，终点与上海11号线延伸线花桥站衔接，也就是说，苏州的S1连接了昆山主城区和上海，还有昆山主城区至苏州。,澎湃新闻,商务部回应消费降级：大众化商品销售好反映消费升级新趋势,https://www.thepaper.cn/newsDetail_forward_2414529,4小时前,2018-09-06 20:42:11
100,商务部新闻发言人高峰在6日的例行发布会上表示，关于“消费降级”的说法，认为有失偏颇。当前市场出现部分大众化商品销售较好的情况，从一个侧面反映了消费升级的新趋势。,澎湃新闻,视频|新生军训，学长学姐炫耀吃冰镇西瓜被批,https://www.thepaper.cn/newsDetail_forward_2414452,4小时前,2018-09-06 20:42:11
101,9月4日，河南。郑州财经学院新生军训时，学长手持冰镇西瓜穿越队伍并食用。网传校董会令当事学生停课陪新生军训。6日，院方称，该说法系开玩笑，校领导仅对其批评。,澎湃新闻,沪指失守2700点：绩优白马股集体杀跌，三大股指震荡走低,https://www.thepaper.cn/newsDetail_forward_2414238,4小时前,2018-09-06 20:42:11
102,9月6日，沪深两市三大股指继续杀跌，沪指失守2700点。截至收盘，上证综指跌0.47%，深证成指跌0.93%，创业板指数跌0.52%。,澎湃新闻,深观察｜勒死“传销看守”案：不能苛求“完美防卫人”,https://www.thepaper.cn/newsDetail_forward_2414473,4小时前,2018-09-06 20:42:12
103,只要有足够证据证明这一点，在当时张某被害的被动环境下，王某的行为足以评价为“行凶”，那张某就不应该承担刑责。,澎湃新闻,欧洲国家联赛要来了，“德法大战”我们也会看腻的,https://www.thepaper.cn/newsDetail_forward_2410024,4小时前,2018-09-06 20:42:12
104,这一重要程度远胜热身赛、却又显然在预选赛之下的崭新赛事，究竟是为巨星“增负”的鸡肋，还是改变欧洲国家队势力版图的风向标？,澎湃新闻,视频|合肥天鹅湖鳄鱼“落网”，被送动物园,https://www.thepaper.cn/newsDetail_forward_2414481,4小时前,2018-09-06 20:42:12
105,9月5日，安徽合肥蜀山区宣传部发布消息称，天鹅湖小鳄鱼已被抓住。该鳄鱼于8月27日被人发现后一直在搜索抓捕。据悉，其品种是泰国暹罗鳄，现已送往合肥野生动物园。,澎湃新闻,数名旅俄中国公民违规放飞无人机受俄方行政处罚，中使馆提醒,https://www.thepaper.cn/newsDetail_forward_2414649,4小时前,2018-09-06 20:42:12
106,据中国驻俄罗斯大使馆网站消息，日前，几名旅俄中国公民因未按规定放飞小型无人机（四轴飞行器）而受到俄方行政处罚，驻俄使馆特提醒广大无人机爱好者，勿随意放飞无人机。,澎湃新闻,视频|普京又上电视节目了，这次是周播真人秀,https://www.thepaper.cn/newsDetail_forward_2414336,4小时前,2018-09-06 20:42:12
107,9月2日，俄罗斯国家电视台开播一档关于普京的新节目《莫斯科-克里姆林宫-普京》。节目关注普京每周的活动，不过网友却对该节目不买账。,澎湃新闻,马蜂窝又现订房失误：用户2万元订海外酒店入住时得知没订单,https://www.thepaper.cn/newsDetail_forward_2414454,4小时前,2018-09-06 20:42:12
108,在酒店入住时，他们却被告知酒店根本没有收到订单。紧急联系马蜂窝客服时，对方承认并未预定成功。李女士最终定到了另一家酒店入住，她认为马蜂应当按退一赔三进行赔偿。,澎湃新闻,外交部：欢迎朝韩领导人平壤会晤，乐见朝韩寻求半岛持久和平,https://www.thepaper.cn/newsDetail_forward_2414613,4小时前,2018-09-06 20:42:12
109,华春莹表示，作为半岛近邻，中方始终乐见并支持作为半岛问题直接当事方的朝韩保持接触对话，持续推进和解合作，寻求实现半岛无核化和半岛持久和平。,澎湃新闻,湖南一高校疑以毕业证强迫学生实习，发声明称要“家国共担”,https://www.thepaper.cn/newsDetail_forward_2414469,4小时前,2018-09-06 20:42:12
110,近日，网络贴吧，微信等平台出现了大量关于“湖南信息职业技术学院（望城区）以毕业证相威胁，强制学生去流水线实习，且专业严重不对口”的帖子。,澎湃新闻,湖北黄冈一移民点建设缓慢，3名干部被国务院督查组约谈,https://www.thepaper.cn/newsDetail_forward_2414315,4小时前,2018-09-06 20:42:12
111,“前年开始收钱说给我们异地搬迁，到现在才刚刚挖了个屋基。”国务院第十七督查组日前收到这一线索反映后，迅速赶往湖北省黄冈市蕲春县漕河镇马冲村实地调查。,澎湃新闻,风从海上来・影记｜传奇之路：永立时尚前沿的百年淮海路,https://www.thepaper.cn/newsDetail_forward_2410608,4小时前,2018-09-06 20:42:12
112,淮海中路位于上海市中心，是上海最繁华的商业街之一，于20世纪30年代形成时尚商业街，以“东方巴黎时尚街”而闻名。,澎湃新闻,马上评｜涉黄的价值观不换，“拼床”的马甲换再多也白搭,https://www.thepaper.cn/newsDetail_forward_2414555,4小时前,2018-09-06 20:42:12
113,不与法律与公序良俗相悖，不将公共利益视为自身逐利的筹码，当是最起码的底线。否则，一旦在价值观上“越轨”，即便马甲换得再勤，也难逃被淘汰的命运。,澎湃新闻,驻札幌总领馆：已赴机场撤离滞留游客，暂无中国公民伤亡报告,https://www.thepaper.cn/newsDetail_forward_2414359,4小时前,2018-09-06 20:42:13
114,6日，北海道发生强地震，当地停水停电，通信和交通基本瘫痪。新千岁机场被迫关闭，导致游客滞留。中国驻札幌总领馆已启动应急机制，派员赴机场开展工作。,澎湃新闻,新华社聚焦课后托管：避免异化为课后补课，增加学生负担,https://www.thepaper.cn/newsDetail_forward_2414338,4小时前,2018-09-06 20:42:13
115,放学后去哪儿的“三点半”难题困扰着不少教师和家长。全国多地近期密集出台课后托管举措，各方反应如何？新学期伊始，记者走访了多地学校。,澎湃新闻,中国妇女报：低生育率的“锅”，岂能由女性的高工作率来背,https://www.thepaper.cn/newsDetail_forward_2414252,4小时前,2018-09-06 20:42:13
116,将低生育率归咎于中国女性的高工作率，如此论断既缺乏数据支撑，也与事实不符，甚至在逻辑上难以自洽――中国女性都不上班，生育率就上去了？,澎湃新闻,新华社刊文谈网游沉溺：通过网络正能量建设树立正确人生目标,https://www.thepaper.cn/newsDetail_forward_2414308,4小时前,2018-09-06 20:42:13
117,要重视的是，沉溺网络游戏对青少年的危害，已经远不止常见的网瘾、色情内容泛滥等，还可能扭曲他们的价值观，引起青少年网络社交偏差行为。,澎湃新闻,一美国民间代表团访问克里米亚，称将把“真相”带回国,https://www.thepaper.cn/newsDetail_forward_2413742,4小时前,2018-09-06 20:42:13
118,一个由4人组成的美国民间代表团9月6日抵达克里米亚，进行为期三天的访问。访问活动的组织者表示，“来访的目的是了解半岛的实际情况和当地人的生活，并把真相带回国。”,澎湃新闻,铁总多名干部任前公示：发改部主任、客运部主任都将换人,https://www.thepaper.cn/newsDetail_forward_2414449,4小时前,2018-09-06 20:42:13
119,此次人事变动公示于8月31日，公示期为5个工作日（9月1日至9月7日）。截至发稿，此次人事变动仍在公示期内。,澎湃新闻,商务部回应美拟对华2千亿输美商品征税：将视美行动采取反制,https://www.thepaper.cn/newsDetail_forward_2414497,4小时前,2018-09-06 20:42:13
120,商务部新闻发言人高峰表示如美方不顾征求意见中绝大多数企业的反对，一意孤行，对华采取任何新的加征关税措施，中方将不得不做出必要反制。,澎湃新闻,马鞍山市委宣传部原部长苏从勇受审，检方指控22起受贿事实,https://www.thepaper.cn/newsDetail_forward_2414219,4小时前,2018-09-06 20:42:13
121,公诉人采取多媒体示证方式进行分组举证，清晰、直观的展示了被告人苏从勇22起具体受贿事实的证据，被告人苏从勇对检察院指控的犯罪事实供认不讳。,澎湃新闻,香港特区政府运房局：正研究乘客用内地居住证购高铁票,https://www.thepaper.cn/newsDetail_forward_2414295,4小时前,2018-09-06 20:42:13
122,香港特区政府运输及房屋局(运房局)6日向中新社表示，内地高铁营运商及港铁公司正就票务系统接受以内地居住证购票进行研究。,澎湃新闻,外交部回应英军舰在西沙航行：中方依法驱离，敦促停止挑衅,https://www.thepaper.cn/newsDetail_forward_2414482,4小时前,2018-09-06 20:42:13
123,8月31日，英国“海神之子”号船坞登陆舰未经中国政府允许，擅自进入了中国西沙群岛的领海，中国海军依法对英国这艘军舰实施了查证识别，并且予以警告驱离。,澎湃新闻,网约车司机看上“白富美”骗婚骗财，被捕后怀孕7月妻子引产,https://www.thepaper.cn/newsDetail_forward_2414429,4小时前,2018-09-06 20:42:13
124,见到22岁的女孩王某后，陈某便就处心积虑地谋划着与其结婚。靠着谎言和骗术，陈某最终得手，并在一年时间里将王某一家糊弄于股掌，骗取财物近30万元。,澎湃新闻,于海明落泪：感谢国家、政府、警察，对这件事做出公正的判决,https://www.thepaper.cn/newsDetail_forward_2414151,4小时前,2018-09-06 20:42:14
125,9月6日12:35，CCTV1今日说法栏目播出《昆山砍人事件始末》。在拿到《解除取保候审决定书》后，于海明激动落泪：感谢国家、政府、警察，做出了公正的判决。,澎湃新闻,视频|避免扰民，驰援寿光的消防官兵凌晨撤离,https://www.thepaper.cn/newsDetail_forward_2414075,4小时前,2018-09-06 20:42:14
126,9月6日，山东寿光。消防官兵驰援受灾严重的寿光，如今任务完成，为不扰民，他们在凌晨悄悄撤离，得到消息的市民自发来到各个驻地向消防官兵致敬和送行。,澎湃新闻,玫琳凯翁文芝：希望每个家庭都能有一个懂健康的人,https://www.thepaper.cn/newsDetail_forward_2413739,5小时前,2018-09-06 20:42:14
127,随着城市化进程的发展，因膳食结构不合理及运动减少引起的肥胖、高血压、糖尿病、骨质疏松等慢性病却威胁着国民健康。,澎湃新闻,在德被杀留学生：已找到部分尸体，需做DNA对比来确定身份,https://www.thepaper.cn/newsDetail_forward_2414283,5小时前,2018-09-06 20:42:14
128,当地时间8月25日晚，德国耶拿大学一位中国留学生被杀害。经过一周的搜寻，警方于9月4日找到了疑似受害者的头颅及衣物，找到的尸体是否为受害者还需进一步核实。,澎湃新闻,全景视频｜联络桥被撞坏，跑道被淹，旅客滞留大阪关西机场,https://www.thepaper.cn/newsDetail_forward_2414028,5小时前,2018-09-06 20:42:14
129,日本遭遇25年来最强台风侵袭，大阪关西国际机场的联络桥被撞坏，跑道严重浸水，大量旅客滞留机场，并排长队等候大巴离开机场。,澎湃新闻,视频|红舞鞋13后失而复得，网友称是魔力还在,https://www.thepaper.cn/newsDetail_forward_2414019,5小时前,2018-09-06 20:42:14
130,当地时间9月4日，美国联邦调查局称找回了失窃13年的红舞鞋。红舞鞋是1939年《绿野仙踪》中的魔法道具，网友称鞋子能回来是因魔力还在。,澎湃新闻,吉林榆树市通报副市长常健坠楼情况：暂无生命危险,https://www.thepaper.cn/newsDetail_forward_2414306,5小时前,2018-09-06 20:42:14
131,@榆树发布 官方微博9月6日消息，经确认伤者系榆树副市长常健，暂无生命危险。具体坠楼原因正在调查中。,澎湃新闻,视频直播丨中国货轮首次北极圈内航行赴欧洲，航程缩短12天,https://www.thepaper.cn/newsDetail_forward_2414077,5小时前,2018-09-06 20:42:14
132,经过33天的海上航行，中远海运“天恩”号货轮于当地时间9月5日抵达法国西北部港口城市鲁昂，完成首次北极圈内航行。此行是“天恩”轮首次出征“冰上丝绸之路”。,澎湃新闻,哈尔滨警方回应“交警砸车视频”：遭暴力抗法，司机接受讯问,https://www.thepaper.cn/newsDetail_forward_2414278,5小时前,2018-09-06 20:42:14
133,视频中，一名大车司机疑似闯卡后，被交警拦下，交警让司机下车配合检查，但司机拒绝下车，双方发生了冲突，交警将车窗砸碎，随后110赶到了现场。,澎湃新闻,教育部就“精准资助”答澎湃：正会同多部门制定精准认定政策,https://www.thepaper.cn/newsDetail_forward_2413666,5小时前,2018-09-06 20:42:14
134,教育部财务司副司长赵建军表示，精准认定政策将规范认定的依据、认定的程序，避免出现当众诉苦，互相比困的现象。,澎湃新闻,滴滴2018上半年巨亏40亿，补贴高达百亿,https://www.thepaper.cn/newsDetail_forward_2414217,5小时前,2018-09-06 20:42:15
135,9月6日，据媒体报道称，一份来自滴滴出行的财务数据显示，2018年上半年亏损急速扩大至40.4亿元，比2017年全年亏损的25亿元还要多出61%。,澎湃新闻,教育部：2019年计划安排5000名退役大学生士兵读硕士,https://www.thepaper.cn/newsDetail_forward_2414198,5小时前,2018-09-06 20:42:15
136,日前，教育部下发2019年“退役大学生士兵”专项硕士研究生招生计划的通知。该计划将于2019年安排5000人，由北京大学、清华大学等455所普通高等学校承担。,澎湃新闻,上海发布首个《区块链技术与应用白皮书》,https://www.thepaper.cn/newsDetail_forward_2414150,5小时前,2018-09-06 20:42:15
137,2018中国（上海）区块链技术创新峰会暨2018中国（上海）大数据产业创新峰会6日在上海杨浦区举办。,澎湃新闻,战略轰炸机前往地中海军演，俄军或为叙利亚关键一战秣兵厉马,https://www.thepaper.cn/newsDetail_forward_2414041,5小时前,2018-09-06 20:42:15
