,brief,classes_name,header,news_url,pubtime,savetime
138,俄海军总司令介绍，共有34架飞机、26艘海军作战舰艇参与演习。这是冷战结束后俄罗斯在地中海集结海军力量最多的一次，超过了1999年科索沃战争时期派出的兵力规模。,澎湃新闻,天津第8位原区委书记被查：市交通委党委书记王福山落马,https://www.thepaper.cn/newsDetail_forward_2413685,5小时前,2018-09-06 20:42:15
139,据天津当地媒体“今晚报”微信公众号今年1月消息，2017年，天津市各级纪检监察机关运用“四种形态”处置13685人，其中，肃清黄兴国流毒立案36人。,澎湃新闻,北京：长租公寓甲醛超标，租户要求退还房租获法院支持,https://www.thepaper.cn/newsDetail_forward_2414182,5小时前,2018-09-06 20:42:15
140,法官提醒，可以要求中介公司出示装修合同，看看是否为正规公司予以装修。且从装修时间中可以判断装修完毕至实际入住这段时间是否足以“散味”。,澎湃新闻,滚水从天而降烫伤温州女童，肇事者和雇主全责被判赔52万元,https://www.thepaper.cn/newsDetail_forward_2413692,5小时前,2018-09-06 20:42:15
141,浙江温州一女童街边玩耍时被楼上倒下的热水烫伤致残，法院认定涉事窗帘店老板与雇员承担全部责任，判令两被告共同赔偿52万余元。,澎湃新闻,上海发布首个区块链技术与应用白皮书，将培育区块链产业基地,https://www.thepaper.cn/newsDetail_forward_2414199,5小时前,2018-09-06 20:42:15
142,2018中国(上海)区块链技术创新峰会暨2018中国(上海)大数据产业创新峰会6日在上海杨浦区举办。,澎湃新闻,郑州水上救援队获滴滴公司百万捐赠，7日将向法院申请撤诉,https://www.thepaper.cn/newsDetail_forward_2414197,5小时前,2018-09-06 20:42:15
143,9月6日，郑州慈善总会收到北京滴滴无限科技发展有限公司100万元捐赠。郑州水上义务救援队委托律师处表示，救援队将向郑州开发区法院申请撤诉。,澎湃新闻,36天连发9起非洲猪瘟疫情：官方密集行动，疫情总体可控,https://www.thepaper.cn/newsDetail_forward_2414098,5小时前,2018-09-06 20:42:15
144,从首例非洲猪瘟疫情出现至今的36天内，中央有关部门高度重视，并及时采取行动，部署最严防控措施，防止疫情扩散蔓延。,澎湃新闻,云南后妈涉虐杀8岁继女调查：曾说看到孩子就像看到丈夫前妻,https://www.thepaper.cn/newsDetail_forward_2410859,5小时前,2018-09-06 20:42:15
145,昭通市盐津县庙坝镇麻柳村的8岁小女孩刘月月失联，家人和警方组织动员100余人参与寻找。翌日，刘月月被找到时已遇害，其后妈有重大作案嫌疑。,澎湃新闻,“反杀案”于海明接受讯问画面曝光，得知刘海龙死讯崩溃大哭,https://www.thepaper.cn/newsDetail_forward_2414050,5小时前,2018-09-06 20:42:16
146,8月27日，江苏昆山，刘海龙持刀追砍于海明，被反杀身亡。9月1日，于海明被认定为正当防卫，不负刑责。从故意伤害到正当防卫，于海明经历了人生中最难忘的5个日夜。,澎湃新闻,台北五旬男子持刀独闯蔡英文办公室被制服，声称只想见蔡英文,https://www.thepaper.cn/newsDetail_forward_2414099,5小时前,2018-09-06 20:42:16
147,台北市1名52岁的林姓男子于6日上午11时许，持刀到蔡英文办公室后方，假借跟女“宪兵”问路，却趁机偷袭，迅速遭其他“宪兵”压制并通报警方。,澎湃新闻,印度最高法院作出历史性裁决：成年人同性性行为不再是犯罪,https://www.thepaper.cn/newsDetail_forward_2414130,5小时前,2018-09-06 20:42:16
148,印度最高法院6日作出裁决，认为成年人之间在私人空间非强迫性的同性性行为不再是犯罪。法院认为，只要这些行为不伤及妇女和儿童，就不能否认其仅仅是个人的选择。,澎湃新闻,他曾捧红陈思思、杨钰莹，这位古稀音乐家的演唱会大咖云集,https://www.thepaper.cn/newsDetail_forward_2413812,5小时前,2018-09-06 20:42:16
149,“作为一个文艺工作者，这些年来国内的重大事件，我都用我的歌曲创作积极参与着。毕竟我们这一代人始终有一个改变不了的创作理念，就是我的文艺要跟时代结合。”,澎湃新闻,重庆一小区出行要走绝壁栈道，仅一米多宽,https://www.thepaper.cn/newsDetail_forward_2414097,5小时前,2018-09-06 20:42:16
150,重庆市渝中区黄沙溪的一小区，处在下半城的黄沙溪和上半城的肖家湾之间，因地势原因，若小区住户去上半城，需要走凿在悬崖上的一条长约100米的栈道。,澎湃新闻,海河委推进流域河湖“清四乱”行动：严防河长有名无实,https://www.thepaper.cn/newsDetail_forward_2414085,5小时前,2018-09-06 20:42:16
151,要督促各级河长落实责任，做到守河有责、守河担责、守河尽责，严防河长有名无实及不作为、乱作为、慢作为现象发生。,澎湃新闻,暖闻｜18岁女孩带着瘫痪妈妈上大学 ，校方为母女改造宿舍,https://www.thepaper.cn/newsDetail_forward_2414078,5小时前,2018-09-06 20:42:16
152,“学校将全额减免郭红雁大学学费、住宿费。”长江大学方面介绍，学校还将给予郭红雁每月2000元左右的基本生活保障费，每年再向其发放特别贫困补助金3000元。,澎湃新闻,滴滴已向郑州慈善总会捐赠百万，定向用于水上救援队更新设备,https://www.thepaper.cn/newsDetail_forward_2414095,5小时前,2018-09-06 20:42:16
153,滴滴公司已于6日向郑州慈善总会捐赠100万元人民币，该笔款项将定向捐助给郑州水上义务救援队。同时，滴滴还将向中华见义勇为基金会捐赠100万元。,澎湃新闻,内蒙古推动旅游景区门票减免工作，成吉思汗陵等4景区降价,https://www.thepaper.cn/newsDetail_forward_2413587,5小时前,2018-09-06 20:42:16
154,记者4日从内蒙古自治区旅游发展委员会等部门获悉，内蒙古逐步推动降低重点国有景区门票价格工作，最近已有3家景区免费开放、4家景区门票降价。,澎湃新闻,菏泽市委原常委、宣传部部长王永江受贿千万，一审获刑11年,https://www.thepaper.cn/newsDetail_forward_2413986,5小时前,2018-09-06 20:42:16
155,9月6日上午，由淄博市人民检察院提起公诉的菏泽市委原常委、宣传部部长王永江受贿一案，在淄博市中级人民法院公开宣判。,澎湃新闻,上海旅游30条：到2035年建成高品质的世界著名旅游城市,https://www.thepaper.cn/newsDetail_forward_2414084,5小时前,2018-09-06 20:42:17
156,9月6日，上海市政府举行新闻发布会，介绍《关于促进上海旅游高品质发展加快建成世界著名旅游城市的若干意见》编制情况和2018年上海旅游节筹备情况。,澎湃新闻,马上评｜这个大学的第一堂课，或许不仅是上给“00后”的,https://www.thepaper.cn/newsDetail_forward_2414038,6小时前,2018-09-06 20:42:17
157,能在“巨婴”这个充满争议的话题上，听到一位为人师、为世范的校长发表自己的观点，已经是一件很难得的事情。,澎湃新闻,贵阳一小区私家车撞死1岁半幼童，据称车主逃逸后返回扮路人,https://www.thepaper.cn/newsDetail_forward_2413995,6小时前,2018-09-06 20:42:17
158,据小区住户表述：“当时肇事车主停在车位上开出来的时候，正好小孩跑出来，后轮压在头上，车主把车开到小区超市处停好，随后回到现场，假装在那儿问是谁撞的。”,澎湃新闻,公安系统反腐加码：两月内超20名局长副局长被查，多人涉黑,https://www.thepaper.cn/newsDetail_forward_2413895,6小时前,2018-09-06 20:42:17
159,赵克志在会上指出：要深挖彻查“保护伞”，严格落实“一案三查”，对于充当黑恶势力“保护伞”的领导干部和民警，要一查到底，绝不姑息，坚决清除害群之马。,澎湃新闻,旅游口又有贪官落马：泰山景区前一把手被查，前副手刚被双开,https://www.thepaper.cn/newsDetail_forward_2413674,6小时前,2018-09-06 20:42:17
160,谭业刚仕途中很长一段时间是在“旅游口”度过的。谭业刚长期担任泰山风景名胜区一把手，直到2016年年初当选泰安市政协副主席，前后长达12年之久。,澎湃新闻,台湾一男子持镰刀强闯蔡英文办公室，袭击女警卫,https://www.thepaper.cn/newsDetail_forward_2413973,6小时前,2018-09-06 20:42:17
161,今日上午11时左右，一名男子持镰刀欲强行闯入蔡英文办公室，且欲袭击“宪兵”，随后被制服。据其初步供称“只想见蔡英文”。,澎湃新闻,快递员骑车把人撞昏迷吓得逃亡：住了一年帐篷，钱花完后自首,https://www.thepaper.cn/newsDetail_forward_2413945,6小时前,2018-09-06 20:42:17
162,为避免被民警抓住，在逃亡的一年中，他不敢乘车，不敢住宾馆旅店，甚至连手机都不敢拿，背着一个帐篷四处东躲西藏。,澎湃新闻,暖闻｜女子街头昏迷，重症肌无力女医生按压抢救直至体力不支,https://www.thepaper.cn/newsDetail_forward_2413545,6小时前,2018-09-06 20:42:17
163,王丽慧因患瘤和重症肌无力，在全力抢救昏迷女子时她曾因心慌气短停下了，曾经学医的丈夫邬登峰赶紧接手全力按压，夫妻接力救援十五分钟后，救护车赶到。,澎湃新闻,多地星美影院被指拖欠工资，幕后老板曾创办“天上人间”,https://www.thepaper.cn/newsDetail_forward_2413904,6小时前,2018-09-06 20:42:17
164,北京 “天上人间”曾经幕后老板覃辉旗下星美影院，因拖欠员工工资再次被推到风口浪尖。5日，星美在北京的一家影院王女士表示入职星美已超过5年，公司经常拖欠员工工资。,澎湃新闻,光明时评：住宅70年自动续期，后续该不该收费,https://www.thepaper.cn/newsDetail_forward_2413953,6小时前,2018-09-06 20:42:17
165,关于自动续期的规定，既有助于破解部分土地到期后续期困难的问题，也有助于不动产相关部门重新研究续期续费问题，进而促进土地市场和住房市场的健康发展。,澎湃新闻,美国等国研究人员“重新编程”细胞，可使大伤口愈合如初,https://www.thepaper.cn/newsDetail_forward_2413738,6小时前,2018-09-06 20:42:17
166,研究人员成功“重新编程”了伤口中的细胞，将其转化为皮肤细胞前体，从而有助于皮肤伤口愈合。这一技术还可用于修复皮肤损伤和抗衰老，也有助于进一步理解皮肤癌发病机理。,澎湃新闻,中国共享单车撤出曼彻斯特：车辆遭人为破坏严重,https://www.thepaper.cn/newsDetail_forward_2413754,6小时前,2018-09-06 20:42:18
167,摩拜公司当天发表声明说，一年多来，曼彻斯特用户累计使用摩拜单车25万次，行程约29万公里。单车持续遭受人为破坏和盗窃，今年夏季每个月的报损率都达到10%。,澎湃新闻,日本首次承认一工人因福岛核辐射死亡：参与核泄漏善后患肺癌,https://www.thepaper.cn/newsDetail_forward_2413954,6小时前,2018-09-06 20:42:18
168,日本首次承认一名参与福岛核电站核泄漏善后工作的男性工人死于工伤，这名工人2011年3月福岛核电站事故发生后至少两次参与该核电站的监测工作，因核辐射罹患肺癌。,澎湃新闻,深圳富士康宿舍发生情杀案：一男子刺死一女后自杀，两人同厂,https://www.thepaper.cn/newsDetail_forward_2413909,6小时前,2018-09-06 20:42:18
169,深圳龙华警方通报称，黄某（男，25岁）与邓某（女，25岁）系同厂员工，当日上午二人因情感纠纷发生争执，黄某用随身携带的水果刀将邓某刺伤致死后自杀身亡。,澎湃新闻,不满巴拉圭将使馆从耶路撒冷迁回特拉维夫，以色列“报复”,https://www.thepaper.cn/newsDetail_forward_2413837,6小时前,2018-09-06 20:42:18
170,巴拉圭5日表示，将把该国驻以色列大使馆从耶路撒冷迁回特拉维夫。此消息一出，以色列总理内塔尼亚胡旋即下令关闭以色列驻巴拉圭使馆，以示“报复”。,澎湃新闻,福州一派出所长参股色情场所并充当保护伞，放任违法活动被查,https://www.thepaper.cn/newsDetail_forward_2413709,6小时前,2018-09-06 20:42:18
171,福州市公安局一派出所所长在明知辖区内一玉足浴店从事卖淫嫖娼违法犯罪活动的情况下，充当涉恶犯罪组织的“保护伞”，并以他人名义参股经营被查。,澎湃新闻,李宏斌任新疆维吾尔自治区住建厅厅长，李学东不再担任,https://www.thepaper.cn/newsDetail_forward_2413918,6小时前,2018-09-06 20:42:18
172,李宏斌，1966年10月出生，此前担任新疆自治区交通运输厅党委书记、副厅长；李学东，1964年9月出生，此前担任新疆自治区住建厅党组副书记、厅长。,澎湃新闻,乌兰察布市人大副主任、察哈尔右翼中旗旗委书记赵向红被查,https://www.thepaper.cn/newsDetail_forward_2413901,6小时前,2018-09-06 20:42:18
173,据内蒙古自治区纪委监委消息：内蒙古自治区乌兰察布市人大常委会副主任、察哈尔右翼中旗旗委书记赵向红涉嫌严重违纪违法，目前正在接受纪律审查和监察调查。,澎湃新闻,韩国检方要求对前总统李明博判刑20年,https://www.thepaper.cn/newsDetail_forward_2413937,6小时前,2018-09-06 20:42:18
174,据韩联社6日报道，韩国检方要求对前总统李明博判刑20年。根据检方向法院提交的逮捕申请令，李明博涉嫌收受贿赂、挪用公款、逃税漏税、滥用职权等十几项罪名。,澎湃新闻,“异性拼房”APP涉黄屡屡被封，换“马甲”后卷土重来,https://www.thepaper.cn/newsDetail_forward_2413542,6小时前,2018-09-06 20:42:18
175,共享经济是个热词，但打着共享旗号的违法违规项目也层出不穷。近日，曾因涉黄屡遭封禁的“同住拼房”换了个马甲“睡睡”，再度复活。,澎湃新闻,中国网络媒体论坛在宁波开幕，新闻网站传播力榜发布,https://www.thepaper.cn/newsDetail_forward_2413851,6小时前,2018-09-06 20:42:18
176,论坛开幕式和主论坛上发布了《中国新闻网站传播力榜》，科学呈现新闻网站的核心竞争力和综合传播实力，为中国网络媒体的发展提供数据参考。,澎湃新闻,视频|老外携90只假名表出境，称均价50元,https://www.thepaper.cn/newsDetail_forward_2413868,6小时前,2018-09-06 20:42:19
177,近日，四川成都。一名外籍旅客带90只假冒名表出境，被机场海关关员查获，其称手表购于广州，均价约50元，欲带出国售卖。此次拦截的手表如全是正品，价值将逾千万。,澎湃新闻,00后上大学了⑨｜清华新生：我们不自私，有自己的社会担当,https://www.thepaper.cn/newsDetail_forward_2387153,6小时前,2018-09-06 20:42:19
178,谢宇煊说：觉得“学习无用”的人是在找一个荒唐的理由自我欺骗，古今凡能成大事者，必是一个成功的读书人。生活是符合守恒律的，经历多少苦，就能收获多少乐。,澎湃新闻,江西力争瑞梅铁路年底开工，部分地区结束多年无铁路历史,https://www.thepaper.cn/newsDetail_forward_2413789,6小时前,2018-09-06 20:42:19
179,想要富先修路，近日江西铁路建设传来新消息力争瑞梅铁路年底开工！这一条路，赣南人民等了10年！建成后，安远、寻乌将结束没有铁路的历史。,澎湃新闻,女职工深夜没在十分钟内回工作微信被开除，调解获赔1.8万,https://www.thepaper.cn/newsDetail_forward_2413766,6小时前,2018-09-06 20:42:19
